{
  "$schema": "http://json-schema.org/draft-07/schema#",
  "title": "unlock_config",
  "type": "object",
  "properties": {
    "electric_required_level": {
      "type": "number"
    },
    "gold_effect_value": {
      "type": "number"
    },
    "gold_required_level": {
      "type": "number"
    },
    "leaderboard_required_level": {
      "type": "number"
    },
    "levels_required_level": {
      "type": "number"
    },
    "lives_effect_value": {
      "type": "number"
    },
    "lives_required_level": {
      "type": "number"
    },
    "magic_required_level": {
      "type": "number"
    },
    "poison_required_level": {
      "type": "number"
    },
    "wood_effect_value": {
      "type": "number"
    },
    "wood_required_level": {
      "type": "number"
    }
  },
  "required": [],
  "additionalProperties": false
}